{"id":"MOD-IRRIGATION-ADV-001","title":"Advanced Irrigation Distribution and Scheduling","version":"1.0.0","status":"draft","lessons":["LESSON-IRR-UNIFORMITY-001","LESSON-IRR-SCHEDULE-002","LESSON-IRR-MASSBAL-003"],"competencies":["COMP-IRRIGATION-ADV-001"],"assessment":"ASSESS-IRRIGATION-ADV-001"}
